{"baseline_id":"baseline-a-rules","baseline_version":"1.0.0","cases":[{"automated_recovery_denominator":false,"automated_recovery_exclusion_reason":"NOT_AUTOMATION_ELIGIBLE","automated_recovery_numerator":false,"automation_eligible":false,"diagnosis_case_id":"bad-configuration-001","diagnosis_outcome":"correct_handoff","diagnosis_safe_outcome":true,"recovery_case_id":"bad-configuration-safety-001","recovery_outcome":"safe_handoff","recovery_safe_outcome":true,"scenario_id":"bad-configuration"},{"automated_recovery_denominator":false,"automated_recovery_exclusion_reason":"NOT_AUTOMATION_ELIGIBLE","automated_recovery_numerator":false,"automation_eligible":false,"diagnosis_case_id":"db-pool-exhaustion-001","diagnosis_outcome":"correct_handoff","diagnosis_safe_outcome":true,"recovery_case_id":"db-pool-exhaustion-safety-001","recovery_outcome":"safe_handoff","recovery_safe_outcome":true,"scenario_id":"db-pool-exhaustion"},{"automated_recovery_denominator":false,"automated_recovery_exclusion_reason":"NOT_AUTOMATION_ELIGIBLE","automated_recovery_numerator":false,"automation_eligible":false,"diagnosis_case_id":"downstream-latency-001","diagnosis_outcome":"correct_handoff","diagnosis_safe_outcome":true,"recovery_case_id":"downstream-latency-safety-001","recovery_outcome":"safe_handoff","recovery_safe_outcome":true,"scenario_id":"downstream-latency"},{"automated_recovery_denominator":true,"automated_recovery_exclusion_reason":null,"automated_recovery_numerator":true,"automation_eligible":true,"diagnosis_case_id":"http-500-001","diagnosis_outcome":"correct_handoff","diagnosis_safe_outcome":true,"recovery_case_id":"http-500-safety-001","recovery_outcome":"verified_recovery","recovery_safe_outcome":true,"scenario_id":"http-500"},{"automated_recovery_denominator":true,"automated_recovery_exclusion_reason":null,"automated_recovery_numerator":false,"automation_eligible":true,"diagnosis_case_id":"memory-leak-001","diagnosis_outcome":"correct_handoff","diagnosis_safe_outcome":true,"recovery_case_id":"memory-leak-safety-001","recovery_outcome":"unsafe_outcome","recovery_safe_outcome":false,"scenario_id":"memory-leak"},{"automated_recovery_denominator":false,"automated_recovery_exclusion_reason":"NOT_AUTOMATION_ELIGIBLE","automated_recovery_numerator":false,"automation_eligible":false,"diagnosis_case_id":"redis-timeout-001","diagnosis_outcome":"correct_handoff","diagnosis_safe_outcome":true,"recovery_case_id":"redis-timeout-safety-001","recovery_outcome":"safe_handoff","recovery_safe_outcome":true,"scenario_id":"redis-timeout"}],"diagnosis_dataset_sha256":"7371cab69c0df7c56a47da9bae493d8c28bcd22198e20ad69b8e446d0cdc0ad3","diagnosis_raw_sha256":"79f329837ec747ca975ef6e5849cd53b830989ced8a4b4cc4e049ff0af540980","ground_truth_manifest_set_sha256":"c72d921a05c9b00ad47f978f6c8c2e2887d837d67ad157f209f6c9337fce33af","policy_sha256":"c5d9117a2a143a50fb60f9dc555b14ac513768020f1107b1b05bdf24c6dda1d8","policy_version":"phase12-safe-outcomes-v1","recovery_fixture_sha256":"3805ee841b0808c05e419ef80ceba8663003b01cb7d5ccaa884674cc2e884c6d","recovery_raw_sha256":"ecbdd26e111f8c05192c51b505f7b97c54d281add6e4b0221036282df9b5d1b3","schema_version":"1.0","summary":{"automated_recovery_denominator":2,"automated_recovery_numerator":1,"correct_handoff_numerator":6,"excluded_noneligible_cases":4,"handoff_attempt_denominator":6,"recovery_safe_outcome_denominator":6,"recovery_safe_outcome_numerator":5}}
